{
  "$schema": "http://json-schema.org/draft-07/schema#",
  "title": "GeoChart Inputs Schema",
  "description": "This Schema validator validates the GeoChart Inputs.",
  "type": "object",
  "properties": {
    "chart": {
      "description": "Supported types of Chart.",
      "$ref": "#/$defs/chartTypeEnum",
      "default": "line"
    },
    "title": {
      "description": "Optionally provide the title of the Chart.",
      "type": "string"
    },
    "query": {
      "description": "Optionally provide information on how the data should be queried in the table source. When undefined, the data has to be manually provided via datasources[].items values.",
      "type": "object",
      "properties": {
        "type": {
          "description": "Indicate the kind of query to perform.",
          "$ref": "#/$defs/queryTypeEnum"
        },
        "url": {
          "description": "Indicate the url where to fetch the data to build the Chart with - supported urls are Esri services, OGC API Features services or urls pointing to a .json file built on the GeoJson format.",
          "type": "string"
        },
        "queryOptions": {
          "description": "Query parameters to be used when querying the url.",
          "type": "object",
          "properties": {
            "whereClauses": {
              "description": "Indicate how to generate the where clause to fetch the correct data in the table source. This is an array to support filtering on more than 1 field. The 'and' logic operator is implicit.",
              "type": "array",
              "items": {
                "type": "object",
                "properties": {
                  "field": {
                    "description": "Indicate the field name, in the table source, on which to filter.",
                    "type": "string"
                  },
                  "prefix": {
                    "description": "Indicate the prefix to use to build the query (useful to support single-quotes when the attribute to query is a string).",
                    "type": "string"
                  },
                  "valueIs": {
                    "description": "Indicate the value as a literal information (not read from a property name from the datasource).",
                    "type": "string"
                  },
                  "valueFrom": {
                    "description": "Indicate the property name, in the datasource.sourceItem(!), to dynamically read and provide to the query parameters in order to query the table source as indicated by the url.",
                    "type": "string"
                  },
                  "suffix": {
                    "description": "Indicate the suffix to use to build the query (useful to support single-quotes when the attribute to query is a string).",
                    "type": "string"
                  }
                },
                "required": ["field"],
                "oneOf": [
                  { "required": ["valueIs"], "not": { "required": ["valueFrom"] } },
                  { "required": ["valueFrom"], "not": { "required": ["valueIs"] } }
                ]
              }
            },
            "orderByField": {
              "description": "Optionally indicate the property on which to order the results of the data coming from the table source.",
              "type": "string"
            }
          }
        }
      },
      "required": ["type", "url"]
    },
    "geochart": {
      "description": "Groups information on how to build the Chart.",
      "type": "object",
      "properties": {
        "xAxis": {
          "description": "Groups information on the X axis.",
          "type": "object",
          "properties": {
            "property": {
              "description": "Indicate the property name on which to read the information from the table source.",
              "type": "string"
            },
            "type": {
              "description": "Indicate the type of axis.",
              "$ref": "#/$defs/scaleTypeEnum",
              "default": "linear"
            },
            "timeFormat": {
              "description": "Defines the format string(s) used to display or parse time values. Can be a single format string (e.g., 'yyyy-MM-dd HH:mm:ss') or an object with locale-specific format strings keyed by language code (e.g., { \"en\": \"MMM dd, yyyy, HH:mm\", \"fr\": \"d MMM yyyy, HH:mm\" }). Uses standard date formatting tokens (e.g., from date-fns or equivalent). Defaults to 'yyyy-MM-dd HH:mm:ss' if not specified.",
              "oneOf": [
                {
                  "type": "string"
                },
                {
                  "type": "object",
                  "properties": {
                    "en": { "type": "string" },
                    "fr": { "type": "string" }
                  },
                  "required": ["en", "fr"],
                  "additionalProperties": false
                }
              ],
              "default": "yyyy-MM-dd HH:mm:ss"
            },
            "timeIANA": {
              "description": "Specifies the IANA time zone identifier (e.g., 'America/Toronto', 'UTC') used for formatting and interpreting time values. Must be a valid time zone from the IANA Time Zone Database.",
              "type": "string",
              "default": "utc"
            },
            "ticksRule": {
              "description": "The rule to apply to provide the X axis ticks. 'auto' automatically calculates the optimal ticks on the axis. 'data' uses the actual data values to set the optimal ticks on the axis.",
              "type": "string",
              "enum": ["auto", "data"],
              "default": "auto"
            },
            "label": {
              "description": "Indicate the label that should be shown for the axis.",
              "type": "string"
            },
            "usePalette": {
              "description": "Optionally indicate a pre-determined (GeoChart specific) color palette should be used.",
              "type": "boolean",
              "default": false
            },
            "paletteBackgrounds": {
              "description": "Optionally indicate an array of rgba color values to use as the palette for background coloring.",
              "type": "array",
              "items": {
                "description": "A rgba() color",
                "type": "string"
              }
            },
            "paletteBorders": {
              "description": "Optionally indicate an array of rgb color values to use as the palette for border coloring.",
              "type": "array",
              "items": {
                "description": "A rgb() color",
                "type": "string"
              }
            }
          },
          "required": ["property"]
        },
        "yAxis": {
          "description": "Groups information on the Y axis.",
          "type": "object",
          "properties": {
            "property": {
              "description": "Indicate the property name on which to read the information from the table source.",
              "type": "string"
            },
            "type": {
              "description": "Indicate the type of axis.",
              "$ref": "#/$defs/scaleTypeEnum",
              "default": "linear"
            },
            "label": {
              "description": "Indicate the label that should be shown for the axis.",
              "type": "string"
            },
            "usePalette": {
              "description": "Optionally indicate a pre-determined (GeoChart specific) color palette should be used.",
              "type": "boolean",
              "default": false
            },
            "paletteBackgrounds": {
              "description": "Optionally indicate an array of rgba color values to use as the palette for background coloring.",
              "type": "array",
              "items": {
                "description": "A rgba() color",
                "type": "string"
              }
            },
            "paletteBorders": {
              "description": "Optionally indicate an array of rgb color values to use as the palette for border coloring.",
              "type": "array",
              "items": {
                "description": "A rgb() color",
                "type": "string"
              }
            },
            "tooltipSuffix": {
              "description": "Optionally indicate the suffix to use on for the values when displayed in the Chart tooltip.",
              "type": "string"
            }
          },
          "required": ["property"]
        },
        "borderWidth": {
          "description": "Optionally indicate the thickness of the borders (or lines in the line Chart).",
          "type": "number"
        },
        "useSteps": {
          "description": "Optionally indicate if the line Chart should use steps.",
          "oneOf": [
            { "$ref": "#/$defs/stepTypeEnum" },
            { "const": false }
          ],
          "default": false
        },
        "tension": {
          "description": "Optionally indicate if the Chart should use tension when drawing the line between the values (only possible with a line type Chart).",
          "type": "number"
        }
      },
      "required": ["xAxis", "yAxis"]
    },
    "category": {
      "description": "Optionally indicate how the data from the table source should be categorized (this creates the datasets aka the legend).",
      "type": "object",
      "properties": {
        "property": {
          "description": "Indicate the property name to use to categorize records.",
          "type": "string"
        },
        "usePalette": {
          "description": "Optionally indicate a pre-determined (GeoChart specific) color palette should be used.",
          "type": "boolean",
          "default": false
        },
        "paletteBackgrounds": {
          "description": "Optionally indicate an array of rgba color values to use as the palette for background coloring.",
          "type": "array",
          "items": {
            "description": "A rgba() color",
            "type": "string"
          }
        },
        "paletteBorders": {
          "description": "Optionally indicate the array of rgb color values to use as the palette for border coloring.",
          "type": "array",
          "items": {
            "description": "A rgb() color",
            "type": "string"
          }
        }
      },
      "required": ["property"]
    },
    "datasources": {
      "description": "Groups information on the datasources to build the datasource drop down and the Chart.",
      "type": "array",
      "items": {
        "type": "object",
        "properties": {
          "display": {
            "description": "Indicate the string to be displayed in the drop down.",
            "type": "string"
          },
          "sourceItem": {
            "description": "Optionally indicate the source item(!) used when fetching the data using the 'query.url'. The source items represent the features loaded in the drop down. This property has an object with a property that should equal the property in 'query.queryOptions.whereClauses.valueFrom'.",
            "type": "object"
          },
          "value": {
            "description": "Optionally indicate the inner value used for the 'sourceItem' - when 'display' alone isn't sufficient to distinguish the values.",
            "anyOf": [
              { "type": "string" },
              { "type": "number" }
            ]
          },
          "items": {
            "description": "Optionally indicate the actual items used to build the Chart. When a query.url is specified, the items will be fetched automatically. When items are specified/populated, the data isn't fetched via the 'query.url'.",
            "type": "array",
            "items": {
              "type": "object"
            }
          }
        },
        "required": ["display"]
      }
    },
    "ui": {
      "description": "Optionally indicate what UI elements to show alongside the Chart.",
      "type": "object",
      "properties": {
        "xSlider": {
          "description": "Groups information on the X axis slider.",
          "type": "object",
          "properties": {
            "display": {
              "description": "Indicate if the slider on the X axis should be displayed.",
              "type": "boolean"
            },
            "step": {
              "description": "Optionally indicate the steps the slider should jump when sliding.",
              "type": "number"
            },
            "min": {
              "description": "Optionally indicate the minimum value for the slider.",
              "type": "number"
            },
            "max": {
              "description": "Optionally indicate the maximum value for the slider.",
              "type": "number"
            }
          },
          "required": ["display"]
        },
        "ySlider": {
          "description": "Groups information on the Y axis slider.",
          "type": "object",
          "properties": {
            "display": {
              "description": "Optionally indicate if the slider on the Y axis should be displayed",
              "type": "boolean"
            },
            "step": {
              "description": "Optionally indicate the steps the slider should jump when sliding.",
              "type": "number"
            },
            "min": {
              "description": "Optionally indicate the minimum value for the slider.",
              "type": "number"
            },
            "max": {
              "description": "Optionally indicate the maximum value for the slider.",
              "type": "number"
            }
          },
          "required": ["display"]
        },
        "stepsSwitcher": {
          "description": "Optionally indicate if a drop down should be shown allowing to switch the steps on-the-fly.",
          "oneOf": [
            {
              "type": "array",
              "items": {
                "oneOf": [
                  { "$ref": "#/$defs/stepTypeEnum" },
                  { "const": false }
                ]
              },
              "minItems": 1,
              "uniqueItems": true
            },
            { "type": "boolean" }
          ],
          "default": false
        },
        "scalesSwitcher": {
          "description": "Optionally indicate if a drop down should be shown allowing to switch the scales on-the-fly.",
          "oneOf": [
            {
              "type": "array",
              "items": { "$ref": "#/$defs/scaleTypeEnum" },
              "minItems": 1,
              "uniqueItems": true
            },
            { "type": "boolean" }
          ],
          "default": false
        },
        "resetStates": {
          "description": "Optionally indicate if the button to reset the states should be displayed.",
          "type": "boolean",
          "default": false
        },
        "description": {
          "description": "Optionally indicate descriptive text to show at the bottom of the Chart.",
          "type": "string"
        },
        "download": {
          "description": "Optionally indicate if a download button should be displayed.",
          "type": "boolean",
          "default": false
        }
      }
    },
    "chartjsOptions": {
      "description": "Optionally indicate further ChartJS specific options to open the door to further customization when natively supported by ChartJS: https://www.chartjs.org/docs/latest/general/options.html",
      "type": "object"
    }
  },
  "required": ["chart", "geochart", "datasources"],
  "$defs": {
    "chartTypeEnum": {
      "type": "string",
      "enum": ["line", "bar", "pie", "doughnut"]
    },
    "queryTypeEnum": {
      "type": "string",
      "enum": ["esriRegular", "ogcAPIFeatures", "json"]
    },
    "scaleTypeEnum": {
      "type": "string",
      "enum": ["linear", "logarithmic", "category", "time", "timeseries"]
    },
    "stepTypeEnum": {
      "type": "string",
      "enum": ["before", "after", "middle"]
    }
  }
}