{
  "chart": "line",
  "title": "Line Chart with time on x and sliders and steps|tension",
  "query": {
    "type": "esriRegular",
    "url": "https://maps-cartes.services.geo.ca/server_serveur/rest/services/HC/airborne_radioactivity_en/MapServer/3",
    "queryOptions": {
      "whereClauses": [
        {
          "field": "Location_Emplacement",
          "prefix": "'",
          "valueFrom": "Location_Emplacement",
          "suffix": "'"
        }
      ],
      "orderByField": "CollectionStart_DebutPrelevement"
    }
  },
  "geochart": {
    "borderWidth": 2,
    "useSteps": "after",
    "tension": 0.3,
    "xAxis": {
      "type": "time",
      "timeFormat": "MMM d, yyyy, HH:mm",
      "timeIANA": "Europe/Paris",
      "property": "CollectionStart_DebutPrelevement",
      "label": "Collected date",
      "usePalette": false
    },
    "yAxis": {
      "type": "logarithmic",
      "property": "Activity_Activite_mBqm3",
      "label": "Activity (mBqm3)"
    }
  },
  "category": {
    "property": "Radionuclide_Radionucleide",
    "usePalette": false
  },
  "ui": {
    "xSlider": {
      "display": true
    },
    "ySlider": {
      "display": true,
      "step": 0.1
    },
    "scalesSwitcher": ["linear", "logarithmic"],
    "stepsSwitcher": ["middle", "after"]
  },
  "datasources": [
    {
      "display": "Vancouver",
      "sourceItem": {
        "Location_Emplacement": "Vancouver"
      }
    },
    {
      "display": "Regina",
      "sourceItem": {
        "Location_Emplacement": "Regina"
      }
    },
    {
      "display": "Ottawa",
      "sourceItem": {
        "Location_Emplacement": "Ottawa"
      }
    },
    {
      "display": "Montreal",
      "sourceItem": {
        "Location_Emplacement": "Montreal"
      }
    },
    {
      "display": "Quebec",
      "sourceItem": {
        "Location_Emplacement": "Quebec"
      }
    }
  ]
}
