{
  "chart": "line",
  "title": "Line Chart slim config",
  "query": {
    "type": "esriRegular",
    "url": "https://maps-cartes.services.geo.ca/server_serveur/rest/services/HC/airborne_radioactivity_en/MapServer/3",
    "queryOptions": {
      "whereClauses": [
        {
          "field": "Location_Emplacement",
          "prefix": "'",
          "valueFrom": "Location_Emplacement",
          "suffix": "'"
        }
      ],
      "orderByField": "CollectionStart_DebutPrelevement"
    }
  },
  "geochart": {
    "xAxis": {
      "type": "time",
      "timeFormat": "MMM d, yyyy, HH:mm",
      "property": "CollectionStart_DebutPrelevement"
    },
    "yAxis": {
      "property": "Activity_Activite_mBqm3"
    }
  },
  "category": {
    "property": "Radionuclide_Radionucleide",
    "usePalette": false
  },
  "datasources": [
    {
      "display": "Vancouver",
      "sourceItem": {
        "Location_Emplacement": "Vancouver"
      }
    },
    {
      "display": "Regina",
      "sourceItem": {
        "Location_Emplacement": "Regina"
      }
    }
  ]
}
