{
  "chart": "bar",
  "title": "Bar Chart",
  "geochart": {
    "xAxis": {
      "property": "Location_Emplacement",
      "label": "Location",
      "usePalette": false
    },
    "yAxis": {
      "property": "Activity_Activite_mBqm3",
      "label": "Activity (mBqm3)"
    }
  },
  "category": {
    "property": "Radionuclide_Radionucleide",
    "usePalette": false
  },
  "ui": {
    "xSlider": {
      "display": true
    },
    "ySlider": {
      "display": true
    },
    "resetStates": true,
    "download": true
  },
  "datasources": [
    {
      "value": "1",
      "display": "Feature 1",
      "items": [
        {
          "Location_Emplacement": "Victoria",
          "CollectionStart_DebutPrelevement": 1678320000000,
          "Radionuclide_Radionucleide": "7Be",
          "Activity_Activite_mBqm3": 2.7395,
          "OBJECTID": 56874
        },
        {
          "Location_Emplacement": "Vancouver",
          "CollectionStart_DebutPrelevement": 1669248000000,
          "Radionuclide_Radionucleide": "7Be",
          "Activity_Activite_mBqm3": 0.83,
          "OBJECTID": 56875
        },
        {
          "Location_Emplacement": "Vancouver",
          "CollectionStart_DebutPrelevement": 1669248000000,
          "Radionuclide_Radionucleide": "7Be",
          "Activity_Activite_mBqm3": 2,
          "OBJECTID": 56871
        },
        {
          "Location_Emplacement": "Yellowknife",
          "CollectionStart_DebutPrelevement": 1679443200000,
          "Radionuclide_Radionucleide": "210Pb",
          "Activity_Activite_mBqm3": 1.0166,
          "OBJECTID": 56876
        },
        {
          "Location_Emplacement": "Vancouver",
          "CollectionStart_DebutPrelevement": 1678406400000,
          "Radionuclide_Radionucleide": "210Pb",
          "Activity_Activite_mBqm3": 0.939,
          "OBJECTID": 56877
        },
        {
          "Location_Emplacement": "Montreal",
          "CollectionStart_DebutPrelevement": 1679011200000,
          "Radionuclide_Radionucleide": "210Pb",
          "Activity_Activite_mBqm3": 1.1814,
          "OBJECTID": 56878
        },
        {
          "Location_Emplacement": "Toronto",
          "CollectionStart_DebutPrelevement": 1677974400000,
          "Radionuclide_Radionucleide": "210Pb",
          "Activity_Activite_mBqm3": 0.6715,
          "OBJECTID": 56879
        },
        {
          "Location_Emplacement": "Montreal",
          "CollectionStart_DebutPrelevement": 1668643200000,
          "Radionuclide_Radionucleide": "7Be",
          "Activity_Activite_mBqm3": 3.2589,
          "OBJECTID": 56880
        }
      ]
    }
  ]
}
