{
  "chart": "bar",
  "title": "The Title 5",
  "geochart": {
    "xAxis": {
      "property": "label"
    },
    "yAxis": {
      "property": "data"
    }
  },
  "category": {
    "property": "location",
    "usePalette": false
  },
  "ui": {
    "xSlider": {
      "display": true
    },
    "ySlider": {
      "display": true
    },
    "resetStates": true,
    "download": true
  },
  "datasources": [
    {
      "display": "Feature",
      "items": [
        { "data": 92, "label": "Hockey", "location": "Victoria" },
        { "data": 43.54, "label": "Baseball", "location": "Victoria" },
        { "data": 12.3, "label": "Basketball", "location": "Victoria" },
        { "data": 66, "label": "Football", "location": "Victoria" },
        { "data": 75, "label": "Soccer", "location": "Victoria" },
        { "data": 553, "label": "Hockey", "location": "Toronto" },
        { "data": 54, "label": "Baseball", "location": "Toronto" },
        { "data": 32.553, "label": "Basketball", "location": "Toronto" },
        { "data": 5.43, "label": "Football", "location": "Toronto" },
        { "data": 55, "label": "Soccer", "location": "Toronto" },
        { "data": 155, "label": "Hockey", "location": "Montreal" },
        { "data": 55, "label": "Baseball", "location": "Montreal" },
        { "data": 255, "label": "Basketball", "location": "Montreal" }
      ]
    }
  ]
}
